{
  "workflow_version": "RBC-LAND-007-FULLTEXT-v0.1.0",
  "scope": "bounded_69_record_locator_and_full_text_eligibility_workflow",
  "source_screening_sha256": "sha256:a7585914c7c40c5df7769686c6e78f4f4ac7ceba06a6bf47b95bad77ed4247f3",
  "locator_observations_sha256": "sha256:73a9cd02abcce31c5db3e6ff1fb97d86a7c0869aee1294b2c9031d9bc00db289",
  "eligibility_resolutions_sha256": null,
  "content_retention": "metadata_only_no_abstract_or_full_text_bytes",
  "state_machine": {
    "reachable": "pending_content_assessment",
    "access_restricted": "pending_lawful_access",
    "not_found_or_failure": "pending_locator_resolution",
    "hash_bound_resolution": "include_exclude_or_uncertain"
  },
  "allowed_exclusion_reasons": [
    "duplicate_entity_or_release",
    "insufficient_public_evidence_for_eligibility",
    "not_initiative_dataset_software_standard_mandate_or_method",
    "not_rare_disease_scope",
    "retracted_or_withdrawn"
  ],
  "counts": {
    "retained_input": 69,
    "locator_status": {
      "access_restricted": 8,
      "reachable": 61
    },
    "eligibility_state": {
      "pending_content_assessment": 61,
      "pending_lawful_access": 8
    },
    "final_decisions": 0
  },
  "decisions": [
    {
      "canonical_key": "doi:10.1016/j.rare.2024.100046",
      "identifier": "10.1016/j.rare.2024.100046",
      "title": "First year results and insights from the Mexican Rare Disease Patient Registry",
      "canonical_url": "https://doi.org/10.1016/j.rare.2024.100046",
      "locator_status": "reachable",
      "http_status": 200,
      "final_url": "https://linkinghub.elsevier.com/retrieve/pii/S2950008724000292",
      "content_type": "text/html",
      "checked_at": "2026-08-14T20:26:58+00:00",
      "eligibility_state": "pending_content_assessment",
      "reason": "public_locator_reachable_but_content_not_assessed",
      "evidence_sha256": null
    },
    {
      "canonical_key": "doi:10.1016/j.rare.2025.100069",
      "identifier": "10.1016/j.rare.2025.100069",
      "title": "Erratum to \u201cFirst year results and insights from the Mexican Rare Disease Patient Registry\u201d [Rare 2 (2024) 100046]",
      "canonical_url": "https://doi.org/10.1016/j.rare.2025.100069",
      "locator_status": "reachable",
      "http_status": 200,
      "final_url": "https://linkinghub.elsevier.com/retrieve/pii/S2950008725000134",
      "content_type": "text/html",
      "checked_at": "2026-08-14T20:26:58+00:00",
      "eligibility_state": "pending_content_assessment",
      "reason": "public_locator_reachable_but_content_not_assessed",
      "evidence_sha256": null
    },
    {
      "canonical_key": "doi:10.1016/j.rare.2025.100075",
      "identifier": "10.1016/j.rare.2025.100075",
      "title": "Author\u2019s response to \u201cCorrespondence on First year result and insights from the Mexican Rare Disease Patient Registry\u201d",
      "canonical_url": "https://doi.org/10.1016/j.rare.2025.100075",
      "locator_status": "reachable",
      "http_status": 200,
      "final_url": "https://linkinghub.elsevier.com/retrieve/pii/S2950008725000195",
      "content_type": "text/html",
      "checked_at": "2026-08-14T20:26:58+00:00",
      "eligibility_state": "pending_content_assessment",
      "reason": "public_locator_reachable_but_content_not_assessed",
      "evidence_sha256": null
    },
    {
      "canonical_key": "doi:10.1016/s0140-6736(15)60420-2",
      "identifier": "10.1016/s0140-6736(15)60420-2",
      "title": "Reducing the cost of rare disease drugs",
      "canonical_url": "https://doi.org/10.1016/s0140-6736(15)60420-2",
      "locator_status": "reachable",
      "http_status": 200,
      "final_url": "https://linkinghub.elsevier.com/retrieve/pii/S0140673615604202",
      "content_type": "text/html",
      "checked_at": "2026-08-14T20:26:58+00:00",
      "eligibility_state": "pending_content_assessment",
      "reason": "public_locator_reachable_but_content_not_assessed",
      "evidence_sha256": null
    },
    {
      "canonical_key": "doi:10.1056/cat.19.1116",
      "identifier": "10.1056/cat.19.1116",
      "title": "Coordinated, Cost-effective Care for Rare Disease: The Cystinosis Outpatient Consultation Program at RoMed",
      "canonical_url": "https://doi.org/10.1056/cat.19.1116",
      "locator_status": "access_restricted",
      "http_status": 403,
      "final_url": "https://catalyst.nejm.org/doi/10.1056/CAT.19.1116",
      "content_type": "text/html",
      "checked_at": "2026-08-14T20:26:58+00:00",
      "eligibility_state": "pending_lawful_access",
      "reason": "locator_requires_access_not_circumvented",
      "evidence_sha256": null
    },
    {
      "canonical_key": "doi:10.1097/01.ede.0000153643.88019.92",
      "identifier": "10.1097/01.ede.0000153643.88019.92",
      "title": "Estimating Rare Disease Prevalence From Administrative Hospitalization Databases",
      "canonical_url": "https://doi.org/10.1097/01.ede.0000153643.88019.92",
      "locator_status": "reachable",
      "http_status": 200,
      "final_url": "https://www.ovid.com/jnls/epidem/fulltext/10.1097/01.ede.0000153643.88019.92~estimating-rare-disease-prevalence-from-administrative",
      "content_type": "text/html",
      "checked_at": "2026-08-14T20:26:58+00:00",
      "eligibility_state": "pending_content_assessment",
      "reason": "public_locator_reachable_but_content_not_assessed",
      "evidence_sha256": null
    },
    {
      "canonical_key": "doi:10.1109/bibm52615.2021.9669517",
      "identifier": "10.1109/bibm52615.2021.9669517",
      "title": "Etiology context of rare diseases in the Human Disease Ontology",
      "canonical_url": "https://doi.org/10.1109/bibm52615.2021.9669517",
      "locator_status": "reachable",
      "http_status": 202,
      "final_url": "https://ieeexplore.ieee.org/document/9669517/",
      "content_type": "text/html",
      "checked_at": "2026-08-14T20:26:58+00:00",
      "eligibility_state": "pending_content_assessment",
      "reason": "public_locator_reachable_but_content_not_assessed",
      "evidence_sha256": null
    },
    {
      "canonical_key": "doi:10.1109/bibm55620.2022.9995614",
      "identifier": "10.1109/bibm55620.2022.9995614",
      "title": "Identifying Missing IS-A Relations in Orphanet Rare Disease Ontology",
      "canonical_url": "https://doi.org/10.1109/bibm55620.2022.9995614",
      "locator_status": "reachable",
      "http_status": 202,
      "final_url": "https://ieeexplore.ieee.org/document/9995614/",
      "content_type": "text/html",
      "checked_at": "2026-08-14T20:26:58+00:00",
      "eligibility_state": "pending_content_assessment",
      "reason": "public_locator_reachable_but_content_not_assessed",
      "evidence_sha256": null
    },
    {
      "canonical_key": "doi:10.1109/cbms49503.2020.00039",
      "identifier": "10.1109/cbms49503.2020.00039",
      "title": "Subgrouping Rare Disease Patients Leveraging the Human Phenotype Ontology Embeddings",
      "canonical_url": "https://doi.org/10.1109/cbms49503.2020.00039",
      "locator_status": "reachable",
      "http_status": 202,
      "final_url": "https://ieeexplore.ieee.org/document/9183079/",
      "content_type": "text/html",
      "checked_at": "2026-08-14T20:26:58+00:00",
      "eligibility_state": "pending_content_assessment",
      "reason": "public_locator_reachable_but_content_not_assessed",
      "evidence_sha256": null
    },
    {
      "canonical_key": "doi:10.1111/jep.12281",
      "identifier": "18492100",
      "title": "General knowledge and opinion of future health care and non-health care professionals on rare diseases",
      "canonical_url": "https://zenodo.org/records/18492100",
      "locator_status": "reachable",
      "http_status": 200,
      "final_url": "https://zenodo.org/records/18492100",
      "content_type": "text/html",
      "checked_at": "2026-08-14T20:26:58+00:00",
      "eligibility_state": "pending_content_assessment",
      "reason": "public_locator_reachable_but_content_not_assessed",
      "evidence_sha256": null
    },
    {
      "canonical_key": "doi:10.1177/2633004020902860",
      "identifier": "10.1177/2633004020902860",
      "title": "Introducing Therapeutic Advances in Rare Disease",
      "canonical_url": "https://doi.org/10.1177/2633004020902860",
      "locator_status": "access_restricted",
      "http_status": 403,
      "final_url": "https://journals.sagepub.com/doi/10.1177/2633004020902860",
      "content_type": "text/html",
      "checked_at": "2026-08-14T20:26:58+00:00",
      "eligibility_state": "pending_lawful_access",
      "reason": "locator_requires_access_not_circumvented",
      "evidence_sha256": null
    },
    {
      "canonical_key": "doi:10.1177/26330040241307962",
      "identifier": "10.1177/26330040241307962",
      "title": "Advancing rare disease measurement through the Rare Disease Clinical Outcome Assessment Consortium",
      "canonical_url": "https://doi.org/10.1177/26330040241307962",
      "locator_status": "access_restricted",
      "http_status": 403,
      "final_url": "https://journals.sagepub.com/doi/10.1177/26330040241307962",
      "content_type": "text/html",
      "checked_at": "2026-08-14T20:26:58+00:00",
      "eligibility_state": "pending_lawful_access",
      "reason": "locator_requires_access_not_circumvented",
      "evidence_sha256": null
    },
    {
      "canonical_key": "doi:10.1177/26330040251359676",
      "identifier": "10.1177/26330040251359676",
      "title": "Updated demographics categories to capture the true diversity of an international registry of rare disease patients",
      "canonical_url": "https://doi.org/10.1177/26330040251359676",
      "locator_status": "access_restricted",
      "http_status": 403,
      "final_url": "https://journals.sagepub.com/doi/10.1177/26330040251359676",
      "content_type": "text/html",
      "checked_at": "2026-08-14T20:26:58+00:00",
      "eligibility_state": "pending_lawful_access",